{
  "architecture": {
    "32bit": {
      "shortcuts": [
        [
          "IDE\\bin\\phpstorm.exe",
          "JetBrains\\PhpStorm (Release Candidate)"
        ]
      ]
    },
    "64bit": {
      "shortcuts": [
        [
          "IDE\\bin\\phpstorm64.exe",
          "JetBrains\\PhpStorm (Release Candidate)"
        ]
      ]
    }
  },
  "autoupdate": {
    "hash": {
      "url": "$url.sha256"
    },
    "url": "https://download.jetbrains.com/webide/PhpStorm-$preReleaseVersion.exe#/cosi.7z"
  },
  "checkver": {
    "regex": "version\":\"(?<ver>[\\d.]+)\".*\"build\":\"(?<build>[\\d.]+)\"",
    "replace": "${ver}-${build}",
    "url": "https://data.services.jetbrains.com/products/releases?code=PS&latest=true&platform=zip&type=rc"
  },
  "description": "PhpStorm Release Candidate. Cross-Platform, Lightning-Smart IDE for PHP programming by JetBrains.",
  "extract_to": "IDE",
  "hash": [
    "2c90e51863e42296f935beec78895156018cdbe70a2bbb4ea18974f35a49329a",
    "2255673952a7909596b8783f6e913d2301f91f0def0275fcfbc6371b0ca021f8"
  ],
  "homepage": "https://www.jetbrains.com/phpstorm/",
  "installer": {
    "script": [
      "& \"$dir\\portable.ps1\" $dir $persist_dir",
      "Remove-Item \"$dir\\IDE\\`$*\", \"$dir\\portable.ps1\" -Force -Recurse"
    ]
  },
  "license": {
    "identifier": "Proprietary",
    "url": "https://www.jetbrains.com/store/license.html"
  },
  "persist": [
    "IDE\\bin\\idea.properties",
    "profile"
  ],
  "url": [
    "https://download.jetbrains.com/webide/PhpStorm-231.8109.149.exe#/cosi.7z",
    "https://ghproxy.com/https://raw.githubusercontent.com/shovel-org/Windows-JetBrains-Bucket/main/scripts/portable.ps1"
  ],
  "version": "2023.1-231.8109.149"
}
