{
  "architecture": {
    "64bit": {
      "hash": "bc0bb6992ba5c3c09d3df623a2143a80d0dade156be99fe23fe40cc48ab797df",
      "url": "https://ghproxy.com/https://github.com/JanDeDobbeleer/oh-my-posh/releases/download/v5.14.1/posh-windows-wsl-amd64.7z"
    }
  },
  "autoupdate": {
    "architecture": {
      "64bit": {
        "url": "https://ghproxy.com/https://github.com/JanDeDobbeleer/oh-my-posh/releases/download/v$version/posh-windows-wsl-amd64.7z"
      }
    },
    "hash": {
      "regex": "$sha256",
      "url": "$url.sha256"
    }
  },
  "bin": "bin\\oh-my-posh.exe",
  "checkver": {
    "github": "https://github.com/JanDeDobbeleer/oh-my-posh"
  },
  "description": "A prompt theme engine for any shell",
  "homepage": "https://ohmyposh.dev",
  "license": "GPL-3.0-only",
  "notes": "Refer to 'https://ohmyposh.dev/docs/windows#replace-your-existing-prompt' for shell specific configurations.",
  "persist": "themes",
  "version": "5.14.1"
}
