{
    "version": "2.5.7",
    "description": "Multi-platform auto-proxy client, supporting Sing-box, X-ray, TUIC, Hysteria, Reality, Trojan, SSH etc. It’s an open-source, secure and ad-free.",
    "homepage": "https://hiddify.com/",
    "license": {
        "identifier": "CC-BY-NC-SA-4.0",
        "url": "https://github.com/hiddify/hiddify-app/blob/main/LICENSE.md"
    },
    "architecture": {
        "64bit": {
            "url": "https://github.com/hiddify/hiddify-app/releases/download/v2.5.7/Hiddify-Windows-Portable-x64.zip",
            "hash": "dbb4ae2d70395c20ae3de86afd047f0be9ffb20d42be5a104e332f6469cdb6d7"
        }
    },
    "extract_dir": "HiddifyNext-portable",
    "installer": {
        "script": [
            "ensure \"$persist_dir\" | Out-Null",
            "New-Item \"$env:APPDATA\\Hiddify\" -ItemType Junction -Target \"$persist_dir\" | Out-Null"
        ]
    },
    "uninstaller": {
        "script": "Remove-Item \"$env:APPDATA\\Hiddify\" -Recurse -Force -ErrorAction 'SilentlyContinue'"
    },
    "shortcuts": [
        [
            "HiddifyNext.exe",
            "HiddifyNext"
        ]
    ],
    "checkver": {
        "url": "https://api.github.com/repos/hiddify/hiddify-app/releases",
        "jsonpath": "$[0].assets[*].browser_download_url",
        "regex": "/releases/download/v([\\w.]+)/(?<file>(?:hiddify|Hiddify)-(?:windows|Windows)-(?:portable|Portable)-x64\\.zip)"
    },
    "autoupdate": {
        "architecture": {
            "64bit": {
                "url": "https://github.com/hiddify/hiddify-app/releases/download/v$version/$matchFile"
            }
        }
    }
}
