{
    "homepage": "https://github.com/srwi/EverythingToolbar",
    "description": "Everything integration for the Windows taskbar",
    "version": "1.5.5",
    "url": "https://github.com/srwi/EverythingToolbar/releases/download/1.5.5/EverythingToolbar-1.5.5.msi#/setup.msi_",
    "hash": "ca617b34a6ca89b4410613112265eeabd5726c62291601836003bbb2f2078803",
    "checkver": "github",
    "autoupdate": {
        "url": "https://github.com/srwi/EverythingToolbar/releases/download/$version/EverythingToolbar-$version.msi#/setup.msi_"
    },
    "installer": {
        "script": "Start-Process -Wait msiexec \"/i `\"$dir\\setup.msi_`\"/norestart /qn INSTALLFOLDER=`\"$dir`\"\" -Verb RunAs"
    },
    "uninstaller": {
        "script": "Start-Process -Wait msiexec \"/x `\"$dir\\setup.msi_`\" /qn /norestart\" -Verb RunAs"
    }
}
