{
    "homepage": "https://github.com/dotnet-script/dotnet-script",
    "description": "Run C# scripts from the .NET CLI.",
    "license": "MIT",
    "version": "2.0.0",
    "suggest": {
        "dotnet core SDK": "dotnet-sdk"
    },
    "url": "https://github.com/dotnet-script/dotnet-script/releases/download/2.0.0/dotnet-script.2.0.0.zip",
    "hash": "ad2ee311952c407906e3436589e1e5f6d666941959feeeab24913c551d404066",
    "extract_dir": "dotnet-script",
    "bin": "dotnet-script.cmd",
    "checkver": "github",
    "autoupdate": {
        "url": "https://github.com/dotnet-script/dotnet-script/releases/download/$version/dotnet-script.$version.zip"
    }
}
