{
    "version": "0.13.1",
    "description": "Your favorite Rust → Wasm workflow tool!",
    "homepage": "https://rustwasm.github.io/wasm-pack/",
    "license": "Apache-2.0|MIT",
    "architecture": {
        "64bit": {
            "url": "https://github.com/wasm-bindgen/wasm-pack/releases/download/v0.13.1/wasm-pack-v0.13.1-x86_64-pc-windows-msvc.tar.gz",
            "hash": "4fd5375c2f85bae92c3e8fb14ad0d27b8fb92e85f4397064d9e66a94a79d6fae",
            "extract_dir": "wasm-pack-v0.13.1-x86_64-pc-windows-msvc"
        }
    },
    "bin": "wasm-pack.exe",
    "checkver": {
        "github": "https://github.com/wasm-bindgen/wasm-pack"
    },
    "autoupdate": {
        "architecture": {
            "64bit": {
                "url": "https://github.com/wasm-bindgen/wasm-pack/releases/download/v$version/wasm-pack-v$version-x86_64-pc-windows-msvc.tar.gz",
                "extract_dir": "wasm-pack-v$version-x86_64-pc-windows-msvc"
            }
        }
    }
}
