{
    "version": "3.0.0-rc.16",
    "description": "Steam++ is a toolbox with lots of Steam tools",
    "homepage": "https://steampp.net/",
    "license": "GPL-3.0-only",
    "url": "https://github.com/BeyondDimension/SteamTools/releases/download/3.0.0-rc.16/Steam%2B%2B_v3.0.0-rc.16_win_x64.7z",
    "hash": "36eb952eec538af7e2c4d5b8d7bed8e9232e7349f054f094221e4486f0dbe893",
    "shortcuts": [
        [
            "Steam++.exe",
            "Steam++"
        ]
    ],
    "persist": "AppData",
    "checkver": {
        "url": "https://api.github.com/repos/BeyondDimension/SteamTools/releases",
        "regex": "v([\\w.-]+)_win_x64.7z"
    },
    "autoupdate": {
        "url": "https://github.com/BeyondDimension/SteamTools/releases/download/$version/Steam%2B%2B_v$version_win_x64.7z",
        "hash": {
            "url": "https://api.github.com/repos/BeyondDimension/SteamTools/releases",
            "regex": "$version_win_x64.7z.*?$sha256"
        }
    }
}
