{
    "version": "0.1.46",
    "description": "Single binary, single command SQLite database explorer.",
    "homepage": "https://sqlite-studio.frectonz.io/",
    "license": "MIT",
    "url": "https://github.com/frectonz/sql-studio/releases/download/0.1.46/sql-studio-x86_64-pc-windows-msvc.zip",
    "hash": "239ff9b724f20e9227fa1bba39ebc818c2ea8d3388008f9c42b19fb5615b1461",
    "bin": "sql-studio.exe",
    "checkver": {
        "github": "https://github.com/frectonz/sql-studio/"
    },
    "autoupdate": {
        "url": "https://github.com/frectonz/sql-studio/releases/download/$version/sql-studio-x86_64-pc-windows-msvc.zip",
        "hash": {
            "url": "https://github.com/frectonz/sql-studio/releases/download/$version/sql-studio-x86_64-pc-windows-msvc.zip.sha256"
        }
    }
}
