{
  "version": "1.7.0",
  "description": "A tool for comparing JAR files, including Scala pickled signatures and method code.",
  "homepage": "https://github.com/lightbend-labs/jardiff",
  "license": "Apache-2.0",
  "url": "https://ghproxy.com/https://github.com/lightbend-labs/jardiff/releases/download/v1.7.0/jardiff.jar",
  "hash": "564793f9d64f2cf304c49d63224e2aee30a2cd1f3e7ea580b79030278ff182c9",
  "bin": "jardiff.jar",
  "suggest": {
    "JDK": [
      "java/oraclejdk",
      "java/openjdk",
      "java/adoptopenjdk-hotspot",
      "java/zulu"
    ]
  },
  "checkver": "github",
  "autoupdate": {
    "url": "https://ghproxy.com/https://github.com/lightbend-labs/jardiff/releases/download/v$version/jardiff.jar"
  }
}