{
  "version": "2.0",
  "description": "https://github.com/Kyome22/RunCat365",
  "homepage": "https://github.com/Kyome22/RunCat365",
  "license": "Apache-2.0",
  "architecture": {
    "64bit": {
      "url": "https://ghproxy.com/https://github.com/Kyome22/RunCat365/releases/download/2.0/RunCat-x64.zip",
      "hash": "eac57dff96005068b5a150b261812ce8a8942d934ef2bd1022fecd8481cf7fb5"
    }
  },
  "shortcuts": [
    [
      "RunCat.exe",
      "RunCat"
    ]
  ],
  "suggest": {
    "dotnet core SDK": "dotnet-sdk"
  },
  "checkver": {
    "github": "https://github.com/Kyome22/RunCat365"
  },
  "autoupdate": {
    "architecture": {
      "64bit": {
        "url": "https://ghproxy.com/https://github.com/Kyome22/RunCat365/releases/download/$version/RunCat-x64.zip"
      }
    }
  }
}
