{
  "version": "1.6.0",
  "description": "A Prometheus exporter for Redis metrics.",
  "homepage": "https://github.com/prometheus-community/elasticsearch_exporter",
  "license": "Apache-2.0",
  "architecture": {
    "64bit": {
      "url": "https://ghproxy.com/https://github.com/prometheus-community/elasticsearch_exporter/releases/download/v1.6.0/elasticsearch_exporter-1.6.0.windows-amd64.tar.gz",
      "hash": "94ddd2910549e29cf0215eea70ed424c6b678d4d5e5f29fde52d572cb1bee3a4",
      "extract_dir": "elasticsearch_exporter-1.6.0.windows-amd64"
    },
    "32bit": {
      "url": "https://ghproxy.com/https://github.com/prometheus-community/elasticsearch_exporter/releases/download/v1.6.0/elasticsearch_exporter-1.6.0.windows-386.tar.gz",
      "hash": "6c18764cf3e57270479cdd36faf0e179ca9a2e27fa1f0cac147fa4445ec836fa",
      "extract_dir": "elasticsearch_exporter-1.6.0.windows-386"
    }
  },
  "bin": "elasticsearch_exporter.exe",
  "checkver": "github",
  "autoupdate": {
    "architecture": {
      "64bit": {
        "url": "https://ghproxy.com/https://github.com/prometheus-community/elasticsearch_exporter/releases/download/v$version/elasticsearch_exporter-$version.windows-amd64.tar.gz",
        "extract_dir": "elasticsearch_exporter-$version.windows-amd64"
      },
      "32bit": {
        "url": "https://ghproxy.com/https://github.com/prometheus-community/elasticsearch_exporter/releases/download/v$version/elasticsearch_exporter-$version.windows-386.tar.gz",
        "extract_dir": "elasticsearch_exporter-$version.windows-386"
      }
    },
    "hash": {
      "url": "$baseurl/sha256sums.txt"
    }
  }
}