{
    "version": "0.0.9",
    "description": "A nhentai client",
    "homepage": "https://github.com/ComicSparks/nhentai-cross",
    "license": {
        "identifier": "MIT"
    },
    "architecture": {
        "64bit": {
            "url": "https://github.com/ComicSparks/nhentai-cross/releases/download/v0.0.9/nhentai-cross-v0.0.9-windows-x86_64.zip",
            "hash": "55c57eefa29f7d3b1047f9f9704255120021ea0cf8e2f33ba84d5b607db1d6bf"
        }
    },
    "shortcuts": [
        [
            "nhentai.exe",
            "nhentai"
        ]
    ],
    "checkver": "github",
    "autoupdate": {
        "architecture": {
            "64bit": {
                "url": "https://github.com/ComicSparks/nhentai-cross/releases/download/v$version/nhentai-cross-v$version-windows-x86_64.zip"
            }
        }
    }
}
