{
    "homepage": "https://github.com/TiddlyWiki/TiddlyDesktop",
    "description": "A custom desktop browser for TiddlyWiki 5 and TiddlyWiki Classic, based on nw.js",
    "license": "Unknown",
    "version": "0.0.20",
    "architecture": {
        "64bit": {
            "url": "https://github.com/TiddlyWiki/TiddlyDesktop/releases/download/v0.0.20/tiddlydesktop-win64-v0.0.20.zip",
            "hash": "f43afb959a9111b84afe8e447075cd6f50c228f914af0e2f1b46485f6d5aba9c",
            "extract_dir": "TiddlyDesktop-win64-v0.0.20"
        },
        "32bit": {
            "url": "https://github.com/TiddlyWiki/TiddlyDesktop/releases/download/v0.0.20/tiddlydesktop-win32-v0.0.20.zip",
            "hash": "b0ddb918b36ddcffb9e6e48b0e79b4a1cfbcad0b3fd24043fee1cdb456e65832",
            "extract_dir": "TiddlyDesktop-win32-v0.0.20"
        }
    },
    "bin": [
        [
            "nw.exe",
            "tiddlydesktop"
        ]
    ],
    "shortcuts": [
        [
            "nw.exe",
            "TiddlyDesktop"
        ]
    ],
    "checkver": {
        "url": "https://api.github.com/repos/TiddlyWiki/TiddlyDesktop/tags",
        "jsonpath": "$..name",
        "regex": "v([\\d.]+(-prerelease\\.\\d+)?)"
    },
    "autoupdate": {
        "architecture": {
            "64bit": {
                "url": "https://github.com/TiddlyWiki/TiddlyDesktop/releases/download/v$version/tiddlydesktop-win64-v$version.zip",
                "extract_dir": "TiddlyDesktop-win64-v$version"
            },
            "32bit": {
                "url": "https://github.com/TiddlyWiki/TiddlyDesktop/releases/download/v$version/tiddlydesktop-win32-v$version.zip",
                "extract_dir": "TiddlyDesktop-win32-v$version"
            }
        }
    }
}
