{
  "homepage": "https://github.com/AutoDarkMode/Windows-Auto-Night-Mode",
  "license": "GPL-3.0-or-later",
  "version": "10.4.1.1",
  "url": "https://github.com/AutoDarkMode/Windows-Auto-Night-Mode/releases/download/10.4.1.1/AutoDarkMode_10.4.1.1.zip",
  "hash": "9f56b01643d2bfe9a18e13e1792662b7d50708ab1ac6fedcf87378bbc8fe43b0",
  "bin": "AutoDarkMode.exe",
  "shortcuts": [
    [
      "AutoDarkMode.exe",
      "Windows 10 Auto Dark Mode"
    ]
  ],
  "persist": "overrides.json",
  "checkver": "github",
  "autoupdate": {
    "url": "https://github.com/AutoDarkMode/Windows-Auto-Night-Mode/releases/download/$version/AutoDarkMode_$version.zip",
    "hash": {
      "url": "https://github.com/AutoDarkMode/Windows-Auto-Night-Mode/releases/download/$version/AutoDarkModeX_$version.sha256"
    }
  }
}