{
  "##": "RunAs TrustedInstaller (same as root on unix)",
  "homepage": "https://winaero.com/blog/execti-run-programs-trustedinstaller/",
  "version": "1.0.0",
  "url": "https://github.com/rswch/scoop-app-mirror/raw/master/apps/ExecTI-1.0.0.7z",
  "hash": "c19d8164e58ac2f631826bee38e57dfc3de6a90cb747d001037b6062c2df3b85",
  "bin": "ExecTI.exe",
  "shortcuts": [
    [
      "ExecTI.exe",
      "ExecAsTrustedInstaller"
    ]
  ],
  "persist": [
    "ExecTI.ini"
  ]
}