{
    "version": "2",
    "description": "Manage Windows Defender in a few clicks (Windows 10/11).",
    "homepage": "https://github.com/yeulette/windows-defender-control",
    "license": "Unknown",
    "architecture": {
        "64bit": {
            "url": "https://github.com/yeulette/windows-defender-control/releases/download/WDC/WDC.bat",
            "hash": "8d10ab6532e1283811b4796938d025f4dd8dd6f5c3858c25c3d58e62225724bc"
        }
    },
    "shortcuts": [
        [
            "WDC.bat",
            "windows-defender-control"
        ]
    ],
    "checkver": {
        "url": "https://github.com/yeulette/windows-defender-control/releases",
        "regex": "v([\\d.]+)"
    },
    "autoupdate": {
        "url": "https://github.com/yeulette/windows-defender-control/releases/download/WDC/WDC.bat",
        "hash": {
            "mode": "download"
        }
    }
}
