{
    "version": "1.3.4392.66",
    "description": "OpenVPN Client",
    "homepage": "https://client.pritunl.com",
    "license": {
        "identifier": "Freeware",
        "url": "https://github.com/pritunl/pritunl-client/blob/master/LICENSE"
    },
    "architecture": {
        "64bit": {
            "url": "https://github.com/pritunl/pritunl-client/releases/download/1.3.4392.66/Pritunl.exe#/dl.exe",
            "hash": "31f491e42f72cdf440e3b7e12780b507842e12ea5faa5456da459e6387201bf9"
        }
    },
    "innosetup": true,
    "pre_install": "if (-not (is_admin)) { error 'This package requires admin privileges to install'; break }",
    "post_install": "Invoke-ExternalCommand \"$dir\\post_install.exe\" -RunAs | Out-Null",
    "uninstaller": {
        "script": [
            "if (-not (is_admin)) { error 'This package requires admin privileges to uninstall'; break }",
            "Invoke-ExternalCommand \"$dir\\pre_uninstall.exe\" -RunAs | Out-Null",
            "Remove-Item 'C:\\ProgramData\\Pritunl' -Recurse -Force"
        ]
    },
    "bin": [
        [
            "pritunl.exe",
            "pritunl",
            "--no-main"
        ]
    ],
    "shortcuts": [
        [
            "pritunl.exe",
            "Pritunl"
        ]
    ],
    "checkver": "([\\d.]+)/Pritunl.exe",
    "autoupdate": {
        "architecture": {
            "64bit": {
                "url": "https://github.com/pritunl/pritunl-client/releases/download/$version/Pritunl.exe#/dl.exe",
                "hash": {
                    "url": "https://raw.githubusercontent.com/pritunl/pritunl-client/master/SHA256",
                    "regex": "$version[\\r\\n]+$sha256.*?$basename"
                }
            }
        }
    }
}
