{
    "homepage": "https://github.com/googlefonts/roboto-2",
    "version": "2.138",
    "description": "The Roboto family of fonts. (hrbrthemes)",
    "license": "Apache-2.0",
    "url": "https://github.com/googlefonts/roboto-2/releases/download/v2.138/roboto-unhinted.zip",
    "hash": "70f64c718510a601fbcf752aafe644314dacaeb85474dc689c89787c4a72a728",
    "checkver": "github",
    "autoupdate": {
        "url": "https://github.com/googlefonts/roboto-2/releases/download/v$version/roboto-unhinted.zip"
    }
}
