{
  "version": "1.10.11",
  "description": "A frontend for legendary, the open source Epic Games Launcher alternative.",
  "homepage": "https://github.com/RareDevs/Rare",
  "license": "GPL-3.0-only",
  "architecture": {
    "64bit": {
      "url": "https://github.com/RareDevs/Rare/releases/download/1.10.11/Rare-Windows-1.10.11.zip",
      "hash": "e917b0b8154ea57e0ed37270287f9d18c4df5fbc31bac9112d99e48148cad95e"
    }
  },
  "shortcuts": [
    [
      "Rare.exe",
      "Rare"
    ]
  ],
  "notes": "Rare is NOT portable.",
  "checkver": "github",
  "autoupdate": {
    "architecture": {
      "64bit": {
        "url": "https://github.com/RareDevs/Rare/releases/download/$version/Rare-Windows-$version.zip"
      }
    }
  }
}