{
    "version": "1.1.35",
    "description": "Simple Beat Saber Mod Installer",
    "homepage": "https://github.com/bsmg/ModAssistant",
    "license": "MIT",
    "architecture": {
        "64bit": {
            "url": "https://github.com/bsmg/ModAssistant/releases/download/v1.1.35/ModAssistant.exe",
            "hash": "3aba35dab86c8ce368ebf266c232af096e5b5509cb5f28e11c79efc839f54cc7"
        }
    },
    "shortcuts": [
        [
            "ModAssistant.exe",
            "Beat Saber Mod Assistant"
        ]
    ],
    "checkver": {
        "github": "https://github.com/bsmg/ModAssistant"
    },
    "autoupdate": {
        "architecture": {
            "64bit": {
                "url": "https://github.com/bsmg/ModAssistant/releases/download/v$version/ModAssistant.exe"
            }
        }
    }
}
