{
    "version": "9.5.6",
    "description": "Play your favorite games in a borderless window; no more time consuming alt-tabs",
    "homepage": "https://github.com/andrewmd5/Borderless-Gaming",
    "license": "GPL-2.0",
    "url": "https://github.com/andrewmd5/Borderless-Gaming/releases/download/9.5.6/BorderlessGaming9.5.6_admin_setup.exe",
    "hash": "250d2d883cb9f5a05a60be5b74191ca357489686a979cf7832fcb4c5f0522eda",
    "innosetup": true,
    "shortcuts": [
        [
            "BorderlessGaming.exe",
            "Borderless Gaming"
        ]
    ],
    "checkver": "github",
    "autoupdate": {
        "url": "https://github.com/andrewmd5/Borderless-Gaming/releases/download/$version/BorderlessGaming$version_admin_setup.exe"
    }
}
